<?xml version="1.0" encoding="utf-8"?>
<Project xmlns:xsi="http://www.w3.org/2001/XMLSchema-instance" xsi:noNamespaceSchemaLocation="http://xml.riverscapes.net/RaveBusinessLogic/XSD/project_explorer.xsd">
  <Name>LTPBR Projects</Name>
  <ProjectType>ltpbrprojects</ProjectType>
  <Node xpathlabel="Name" xpath="Realizations/Realization">
    <Children collapsed="false">
      <Node label="Outputs" xpath="Datasets">
        <Children collapsed="false">
          <Node label="LTPBR Projects" xpath="Geopackage/Layers/Vector[@lyrName='projects']" type="point" id="projects" symbology="ltpbr_projects" />
          <Node label="Outputs Geopackage (SQLite Database)" xpath="Geopackage" type="file" /> 
        </Children>
      </Node>
      </Children>
  </Node>
  <Views default="DEFAULT">
    <View name="LTPBR Projects" id="DEFAULT">
      <Layers>
        <Layer id="projects" />
      </Layers>
    </View>
  </Views>
</Project>  