<?xml version="1.0" encoding="utf-8"?>
<Project xmlns:xsi="http://www.w3.org/2001/XMLSchema-instance" xsi:noNamespaceSchemaLocation="http://xml.riverscapes.net/RaveBusinessLogic/XSD/project_explorer.xsd">
  <Name>Riverscapes Context</Name>
  <ProjectType>RSContextBC</ProjectType>
  <Node xpathlabel="Name" xpath="Realizations/Realization">
    <Children collapsed="false">
      <Node label="Transportation Local">
        <Children collapsed="true">
          <Node xpathlabel="Name" xpath="Datasets/Geopackage/Layers/Vector[@lyrName='dra_dgtl_road_atlas_mpar_sp']" type="line" id="roads" />
        </Children>
      </Node>
      <Node label="Hydrology">
        <Children collapsed="false">
				<Node label="Flow Lines" xpath="Datasets/Geopackage[@id='hydrology']/Layers/Vector[@lyrName='flow_lines']" type="line" id="flowlines"/>
				<Node label="Waterbodies" xpath="Datasets/Geopackage[@id='hydrology']/Layers/Vector[@lyrName='waterbodies']" type="polygon" id="waterbodies"/>
				<Node label="Watershed" xpath="Datasets/Geopackage[@id='hydrology']/Layers/Vector[@lyrName='watershed']" type="polygon" id="watershed"/>
        </Children>
      </Node>
      <Node label="Biogeoclimate">
        <Children collapsed="true">
          <Node xpathlabel="Name" xpath="Datasets/Geopackage/Layers/Vector[@lyrName='bec_biogeoclimatic_poly']" type="polygon" id="biogeoclimatic"/>
        </Children>
      </Node>
	  <Node label="Vegetation">
		<Children collapsed="true">
			  <Node xpathlabel="Name" xpath="Datasets/Geopackage/Layers/Vector[@lyrName='veg_comp_lyr_r1_poly']" type="polygon" id="veg_comp" />
		</Children>
	  </Node>
      <Node label="Topography and Derivatives">
        <Children collapsed="true">
          <Node label="DEM (10 m NED)" xpath="Datasets/DEM[@id='dem']" type="raster" symbology="dem" transparency="40" id="dem" />
          <Node label="Slope Analysis" xpath="Datasets/Raster[@id='SLOPE']" type="raster" symbology="slope" transparency="40" />
        </Children>
      </Node>
      <Node label="Hillshade">
        <Children collapsed="true">
          <Node xpathlabel="Name" xpath="Datasets/Raster[@id='hillshade']" type="raster" symbology="hillshade" id="hs" />
        </Children>
      </Node>
    </Children>
  </Node>
  <Views default="Default">
    <View name="Hydrology" id="Default">
      <Layers>
        <Layer id="flowlines" />
        <Layer id="waterbodies" />
        <Layer id="watershed" />
      </Layers>
    </View>
    <View name="Topography" id="Topography">
      <Layers>
        <Layer id="flowlines" />
        <Layer id="dem" />
        <Layer id="hs" />
      </Layers>
    </View>
    <View name="Transportation" id="Transportation">
      <Layers>
        <Layer id="roads" />
      </Layers>
    </View>
    <View name="Existing Vegetation" id="veg">
      <Layers>
        <Layer id="flowlines" />
        <Layer id="veg_comp" /> 
      </Layers>
    </View>
  </Views>
</Project>
