<?xml version="1.0" encoding="utf-8"?>
<Project xmlns:xsi="http://www.w3.org/2001/XMLSchema-instance" xsi:noNamespaceSchemaLocation="http://xml.riverscapes.xyz/RaveBusinessLogic/XSD/project_explorer.xsd">
  <Name>RVD</Name>
  <ProjectType>RVD</ProjectType>
  <Node xpathlabel="Name">
    <Children collapsed="false">
      <Node xpathlabel="Name" xpath="Realizations/RVD/Outputs/HTMLFile" type="file" />
      <Node label="Inputs" xpath="Realizations/RVD/Inputs">
        <Children>
          <Node xpathlabel="Name" xpath="Geopackage/Layers/Vector[@id='FLOWLINES']" type="vector" symbology="" />
          <Node xpathlabel="Name" xpath="Geopackage/Layers/Vector[@id='FLOW_AREA']" type="vector" symbology="" />
          <Node xpathlabel="Name" xpath="Geopackage/Layers/Vector[@id='WATERBODIES']" type="vector" symbology="" />
          <Node xpathlabel="Name" xpath="Geopackage/Layers/Vector[@id='VALLEY_BOTTOM']" type="vector" symbology="" />
          <Node xpathlabel="Name" xpath="Raster[@id='EXVEG']" type="raster" symbology="" />
          <Node xpathlabel="Name" xpath="Raster[@id='HISTVEG']" type="raster" symbology="" />
        </Children>
      </Node>
      <Node label="Intermediates" xpath="Realizations/RVD/Intermediates">
        <Children collapsed="true">
          <Node label="Thiessen Polygons">
            <Children collapsed="true">
              <Node xpathlabel="Name" xpath="Geopackage/Layers/Vector[@id='THIESSEN']" type="vector" symbology="" />
              <Node xpathlabel="Name" xpath="Geopackage/Layers/Vector[@id='THIESSEN_POINTS']" type="vector" symbology="" />
              <Node xpathlabel="Name" xpath="Geopackage/Layers/Vector[@id='THIESSEN_DISSOLVED']" type="vector" symbology="" />
              <Node xpathlabel="Name" xpath="Geopackage/Layers/Vector[@id='THIESSEN_RAW']" type="vector" symbology="" />
            </Children>
          </Node>
          <Node label="Existing Vegetation">
            <Children collapsed="true">
              <Node xpathlabel="Name" xpath="Raster[@id='EXISTING_RAW']" type="raster" symbology="" />
              <Node xpathlabel="Name" xpath="Raster[@id='EXISTING_RIPARIAN']" type="raster" symbology="" />
              <Node xpathlabel="Name" xpath="Raster[@id='EXISTING_NATIVE_RIPARIAN']" type="raster" symbology="" />
              <Node xpathlabel="Name" xpath="Raster[@id='EXISTING_VEGETATED']" type="raster" symbology="" />
              <Node xpathlabel="Name" xpath="Raster[@id='EXISTING_CONVERSION']" type="raster" symbology="" />
              <Node xpathlabel="Name" xpath="Raster[@id='EXISTING_LUI']" type="raster" symbology="" />

            </Children>
          </Node>
          <Node label="Historic Vegetation">
            <Children collapsed="true">
              <Node xpathlabel="Name" xpath="Raster[@id='HISTORIC_RAW']" type="raster" symbology="" />
              <Node xpathlabel="Name" xpath="Raster[@id='HISTORIC_RIPARIAN']" type="raster" symbology="" />
              <Node xpathlabel="Name" xpath="Raster[@id='HISTORIC_NATIVE_RIPARIAN']" type="raster" symbology="" />
              <Node xpathlabel="Name" xpath="Raster[@id='HISTORIC_VEGETATED']" type="raster" symbology="" />
              <Node xpathlabel="Name" xpath="Raster[@id='HISTORIC_CONVERSION']" type="raster" symbology="" />
            </Children>
          </Node>

          <Node xpathlabel="Name" xpath="Raster[@id='RIPARIAN_ZONES']" type="raster" symbology="" />
          <Node xpathlabel="Name" xpath="Raster[@id='NATIVE_RIPARIAN_ZONES']" type="raster" symbology="" />
          <Node xpathlabel="Name" xpath="Raster[@id='VEGETATION_ZONES']" type="raster" symbology="" />
          <Node xpathlabel="Name" xpath="Raster[@id='VEGETATION_CONVERSION']" type="raster" symbology="" />
        </Children>
      </Node>
      <Node label="Outputs" xpath="Realizations/RVD/Outputs">
        <Children>
          <Node label="Riparian Departure" xpath="Geopackage/Layers/Vector[@id='SEGMENTED']" type="vector" id="rvd_output" symbology="RiparianVegetationDeparture" />
          <Node label="Conversion Type" xpath="Geopackage/Layers/Vector[@id='SEGMENTED']" type="vector" id="conversion_type" symbology="RiparianConversionType" />
        </Children>
      </Node>
    </Children>
  </Node>
  <Views default="RVD Output">
    <View name="RVD Output">
      <Layer id="rvd_output" />
      <Layer id="conversion_type" />
    </View>
  </Views>
</Project>