<?xml version="1.0" encoding="utf-8"?>
<Project xmlns:xsi="http://www.w3.org/2001/XMLSchema-instance"
    xsi:noNamespaceSchemaLocation="http://xml.riverscapes.net/RaveBusinessLogic/XSD/project_explorer.xsd">
    <!-- <Project xmlns:xsi="http://www.w3.org/2001/XMLSchema-instance"
    xsi:noNamespaceSchemaLocation="./XSD/project_explorer.xsd"> -->
    <Name>New Zealand National Datasets</Name>
    <ProjectType>NZNational</ProjectType>
    <Node xpathlabel="Name" xpath="Realizations/Realization">
        <Children>
            <Node label="Hydrography">
                <Children collapsed="false">
                    <Node label="Hydro Net Junctions"
                        xpath="Outputs/Geopackage[@id='HYDROGRAPHY']/Layers/Vector[@lyrName='hydro_net_junctions']"
                        type="point" symbology="hydro_net_junctions" id="hydro_net_junctions" />
                    <Node label="River Network"
                        xpath="Outputs/Geopackage[@id='HYDROGRAPHY']/Layers/Vector[@lyrName='riverlines']"
                        type="line" symbology="hydrography" id="riverlines" />
                    <Node label="Lakes"
                        xpath="Outputs/Geopackage[@id='HYDROGRAPHY']/Layers/Vector[@lyrName='nz_lake_polygons_topo_150k']"
                        type="polygon" symbology="lakes" id="lakes" />
                    <Node label="Catchment Wings"
                        xpath="Outputs/Geopackage[@id='HYDROGRAPHY']/Layers/Vector[@lyrName='rec2ws']"
                        type="polygon" symbology="catchment_wings" id="catchment_wings" />
                    <Node label="Watersheds"
                        xpath="Outputs/Geopackage[@id='HYDROGRAPHY']/Layers/Vector[@lyrName='watersheds']"
                        type="polygon" symbology="watersheds" id="wateresheds" />
                </Children>
            </Node>
            <Node label="Transportation">
                <Children collapsed="false">
                    <Node label="Roads"
                        xpath="Outputs/Geopackage[@id='TRANSPORTATION']/Layers/Vector[@lyrName='nzroadcentrelinestopo150k']"
                        type="line" symbology="nz_roads" id="roads" />
                    <Node label="Railways"
                        xpath="Outputs/Geopackage[@id='TRANSPORTATION']/Layers/Vector[@lyrName='nz-railway-centrelines-topo-150k']"
                        type="line" symbology="nz_railways" id="railways" />
                </Children>
            </Node>
            <Node label="Topography">
                <Children collapsed="false">
                    <Node label="DEM North Island"
                        xpath="Outputs/Raster[@id='DEMNORTH']"
                        type="raster" symbology="dem" id="demnorth" />
                    <Node label="DEM South Island"
                        xpath="Outputs/Raster[@id='DEMSOUTH']"
                        type="raster" symbology="dem" id="demsouth" />
                </Children>
            </Node>
            <Node label="Administration">
                <Children collapsed="false">
                    <Node label="New Zealand Regional Councils 2023"
                        xpath="Outputs/Geopackage[@id='ADMINISTRATION']/Layers/Vector[@lyrName='regional_council_2023_generalised']"
                        type="polygon" symbology="regional_councils" id="regional_councils" />
                </Children>
            </Node>
        </Children>
    </Node>
    <Views default="Default">
        <View name="Hydrology" id="Default">
            <Layers>
                <Layer id="riverlines" />
            </Layers>
        </View>
    </Views>
</Project>